"","applicable","male","female","nonBinary","desc","group","name","time"
"133",1,1,0,0,"<p>For our July Data Science DC Meetup, we are excited to have Abhijit Dasgupta join us to talk about meta-analysis - synthesizing direct and indirect effects of treatments, and some applications for big data analyses.</p> <p>---------------------------- </p> <p><br/>Sponsored by <b>Statistics.com</b> -- Learn new skills in Data Science, Analytics, and Statistics! Four-week online courses at all levels, world-class instructors, private discussion boards. <a href=""http://www.statistics.com/?utm_source=dsdc-meetup&amp;utm_medium=meetup&amp;utm_campaign=DSDC2016"">Save 30% with code DSDC2016</a> -- starting soon: biostatistics, predictive modeling, clinical trials, epidemiology, Bayesian, R, Python.</p> <p>----------------------------</p> <p><b>Agenda:</b></p> <p>• 6:30pm -- Networking, Empanadas, and Refreshments</p> <p>• 7:00pm -- Introduction, Announcements</p> <p>• 7:15pm -- Presentation and Discussion</p> <p>• 8:30pm -- Data Drinks (Tonic , 2036 G St NW)</p> <p><b>Abstract:</b></p> <p><b>Meta-analysis: Synthesizing direct and indirect effects of treatments, and some applications for big data analyses.</b></p> <p>Meta-analyses are in the news!!! From affecting <a href=""https://en.wikipedia.org/wiki/Saturated_fat_and_cardiovascular_disease_controversy#Systematic_reviews"">what we choose to eat</a> to looking at <a href=""https://www.autismspeaks.org/science/science-news/new-meta-analysis-confirms-no-association-between-vaccines-and-autism"">vaccines' impact on autism</a>, meta-analyses have an impact in improving our knowledge and understanding, specially when a topic is confusing or has contradictory results and views. It is a means of seeing the forest for the trees, distilling and synthesizing the extant knowledge about a topic.</p> <p>Meta-analyses are mainly seen in the world of biomedical research, so interest is in ""treatments"", namely drugs  or particular diets or the like. However, ""treatments"" can mean a marketing campaign or a behavioral intervention (like spanking) or a change of a protocol. With that understanding, meta-analysis refers to the synthesis of results from several small but comparable studies to derive overall estimates of treatment effects that typically will be more robust and have higher statistical power. </p> <p>Classical meta-analysis involves studies looking at the same treatments to get an overall summary effect of one particular treatment effect. Network meta-analysis can be modeled to utilize indirect comparisons to compare the relative effectiveness of several different treatments of the same condition. In this presentation I will describe both classical and network meta-analysis, as well as the typical problems and biases one has to be aware of in doing meta-analyses. The computations and weighting schemes used in meta-analysis can have direct applications to implement a Divide-and-Conquer strategy so that modeling of large data sets can be done in chunks and the results combined to get valid results for the entire data set. I will describe an example from my experience in fitting competing risks models to a large administrative data set.</p> <p><b>Bio:</b></p> <p><br/><b>Abhijit Dasgupta</b></p> <p>Dr. Abhijit Dasgupta is a consulting statistician/data scientist in the Washington DC metropolis. He is fascinated by the innovative use of data analytic methods to gain insight and tell substantive stories, using modern methods for modeling, simulation and visualization.</p> <p>A PhD-level biostatistician by training, Dr. Dasgupta currently works to bridge the statistics-machine learning divide, by merging machine learning methods with sound statistical thinking and principles to help enhance our ability to derive intelligence from data. He now has over 50 peer-reviewed research and collaborative papers in areas ranging from bioinformatics, cancer research and operations research to methods for cluster analysis and intelligent robust modeling. He also consults for local startups doing bioengineering, business analytics and bioinformatics. Dr. Dasgupta also helps train companies in using R for their analytics needs, leveraging over 20 years experience using R and Python for data analyses and reporting.</p> <p>Dr. Dasgupta also works to build the local data community, organizing the Statistical Programming DC meet up and serving on the Board of Data Community DC.</p> <p><b>Sponsors:</b></p> <p>This event is sponsored by the <a href=""http://business.gwu.edu/programs/specialized-masters/m-s-in-business-analytics/academic-program/"">George Washington Business School MS in Business Analytics Program</a>, <a href=""http://bit.ly/12YljkP"">Statistics.com</a>, <a href=""http://datamininglab.com/"">Elder Research</a>, <a href=""https://www.boozallen.com/consulting/strategic-innovation/nextgen-analytics-data-science"">Booz Allen Hamilton</a>, and <a href=""http://engineering.aol.com/"">AOL</a>. (Would your organization like to sponsor too? Please get in touch!) </p>","Data Science DC","Meta-analysis: Synthesizing direct and indirect effects of treatments",1469053800000
"134",1,2,0,0,"<p>Join your fellow data visualizers on Tuesday, June 26th at Chief(1800 Massachusetts Ave NW) for The Battle of the Viz. University of Maryland Doctoral Students, Adil Yalcin and Fan Du, will be presenting  their own data visualization and analytics tools; Adil Yalcin will be showcasing his data analytics tool Keshif(<a href=""http://keshif.me/""><a href=""http://keshif.me/"" class=""linkified"">http://keshif.me/</a></a>) and Fan Du will be showcasing EventAction(<a href=""http://hcil.umd.edu/eventaction/""><a href=""http://hcil.umd.edu/eventaction/"" class=""linkified"">http://hcil.umd.edu/eventaction/</a></a>).</p> <p><br/>Our speakers are Ph.D. students in the Department of Computer Science at University of Maryland, College Park, and members of its Human Computer Interaction Laboratory (HCIL), which has a 30+ years of history of research and impact in technology and design.</p> <p><b>Agenda</b></p> <p><b>6:30 - 7:10 - Networking</b></p> <p><b>7:10 - 7:40 – Adil Yalcin and Keshif</b></p> <p><b>7:40 - 7:50 – Q &amp; A for Keshif</b></p> <p><b>7:50 - 8:20 – Fan Du and EventFlow</b></p> <p><b>8:20 - 8:30 – Q &amp; A for EventFlow</b></p> <p><b>8:40 - Data Drinks</b></p> <p>SPECIAL DEAL:</p> <p>O'Reilly AI Conference September 26-27 | New York, NY</p> <p>Save 20% - UGDATASCIDC</p> <p>Discover the real-world opportunities of applied artificial intelligence</p> <p><a href=""http://www.oreilly.com/pub/cpc/21362""><a href=""http://www.oreilly.com/pub/cpc/21362"" class=""linkified"">http://www.oreilly.com/pub/cpc/21362</a></a></p> <p><b>About our Presenters: </b></p> <p><b>Adil Yalcin</b><b><br/>Bio: </b>My goal is to lower the barriers in rich data analysis for a broad audience through information visualization and interaction design, implementation, and evaluation. My PhD journey gives me a change to focus on the research and design foundations, and to search for new perspectives to advance how we think about data exploration. By providing highest quality tools and services, I inspire to help people and businesses identify opportunities for data analysis, explore their data, and gain insights at the speed of thought. (<a href=""http://www.adilyalcin.me/"">www.adilyalcin.me</a>)</p> <p><b>Abstract:</b> Visualization is the natural language for data, and interaction can create the natural dialogue. How can we design better spaces to engage in exploratory data dialogue? How can we avoid fruitless paths, and how can we focus on generating insights, not visualizations? In this talk, I will share examples of what inspires my design thinking, and demonstrate the tool I build on those principles, Keshif (<a href=""http://www.keshif.me/"">www.keshif.me</a>).</p> <p><b>Fan Du</b></p> <p><b>Bio: </b>My research focuses on data visualization and human-computer interaction, especially on analyzing healthcare data and user activity logs. I work with Prof. Ben Shneiderman and Dr. Catherine Plaisant as a research assistant. My Ph.D. study focuses on designing interactive data visualization tools to augment people’s ability in handling and exploring temporal event sequences. Moving forward, I want to work with real users from different domains to see how my tools could help them solve problems. (<a href=""http://frankdu.org/"">frankdu.org</a>)</p> <p><b>Abstract</b>: The rapidly growing interest in event analytics has resulted in visual techniques for extracting insights from event sequence data that come from medical histories, social media activities, online education patterns, cybersecurity threats, etc. This talk reviews our group’s decade of research on visualizing and exploring temporal event sequences. I introduce EventFlow (<a href=""http://hcil.umd.edu/eventflow/"">hcil.umd.edu/eventflow</a>) for showing visual summaries of thousands of patient histories represented as time-stamped events and demonstrate how it supports hospital quality control analysts to investigate if the required procedures were carried out. I then describe simplification strategies for sharpening the analytic focus so as to cope with the increase in data volume and pattern variety. Finally, I discuss our recent work on cohort comparison and evidence-based intervention planning.</p> <p>ANNOUNCEMENTS</p> <p>Hiring? Job Seeking? Datable.org</p> <p>Building your brand in tech? Sponsor DC2</p> <p>Have a difficult data question? Ask 13,000 local Data Practitioners with Pushie</p>","Data Visualization DC","The Battle of the Viz",1469572200000
"135",1,1,0,0,"<p>For our August Data Science DC Meetup, we are excited to have John J. Nay,  a Ph.D. Candidate at the Vanderbilt University School of Engineering and a Research Fellow at Vanderbilt Law School’s Program on Law &amp; Innovation, join us to speak about <b>predicting and understanding law with machine learning</b>!</p> <p>---------------------------- </p> <p><br/>Sponsored by <b>Statistics.com</b> -- Learn new skills in Data Science, Analytics, and Statistics! Four-week online courses at all levels, world-class instructors, private discussion boards. <a href=""http://www.statistics.com/?utm_source=dsdc-meetup&amp;utm_medium=meetup&amp;utm_campaign=DSDC2016"">Save 30% with code DSDC2016</a>.</p> <p>----------------------------</p> <p><b>Agenda:</b></p> <p>• 6:30pm -- Networking, Empanadas, and Refreshments</p> <p>• 7:00pm -- Introduction, Announcements</p> <p>• 7:15pm -- Presentation and Discussion</p> <p>• 8:30pm -- Data Drinks (Tonic , 2036 G St NW)</p> <p><b>Abstract:</b></p> <p><b>Predicting and Understanding Law with Machine Learning</b></p> <p>First, we present new methods to embed institutions and their legal text into shared continuous vector space to enable novel investigations into differences across institutions. Our model discerns meaningful differences between government branches. The similarities between learned representations of Congresses over time and sitting Presidents are negatively correlated with the bill veto rate, and the temporal ordering of Presidents and Congresses was implicitly learned from only text.</p> <p>Second, we describe <a href=""http://predictgov.com/"">PredictGov</a>, a machine learning system for predicting Congress. Starting with the 107th Congress, we trained models on data from previous Congresses, predicted all bills in the current Congress, and repeated until the 113th Congress served as the test. The median of the predicted probabilities for enacted bills was 0.71, while the median of the predicted probabilities for failed bills was 0.01. We also conducted a sensitivity analysis on the model to determine important factors predicting enactment. We will describe these results and demonstrate its interactive implementation for real-time predictions of the 114th Congress.</p> <p><b>Bio:</b></p> <p><br/><b>John J. Nay</b></p> <p>John J. Nay is a Ph.D. Candidate at the Vanderbilt University School of Engineering and a Research Fellow at Vanderbilt Law School’s Program on Law &amp; Innovation. He received his bachelor’s degree with High Distinction from the University of Virginia. His computational work is directed toward law and policy applications, including <a href=""http://johnjnay.com/predMarket/"">computer simulations of climate prediction markets</a>, <a href=""http://johnjnay.com/forecastVeg/"">software for forecasting drought globally with satellite data</a>, <a href=""http://journals.plos.org/plosone/article?id=10.1371/journal.pone.0155656"">computational models predicting human cooperation</a>, <a href=""http://www.informs-sim.org/wsc15papers/272.pdf"">software for automatically estimating models of decision-making</a>, <a href=""https://dl.dropboxusercontent.com/u/108075111/Nay_2016_gov2vec.pdf"">natural language processing of law and policy</a>, and <a href=""http://arxiv.org/abs/1607.02109"">machine learning for predicting and understanding law-making</a>. He is currently collaborating with social scientists, environmental scientists, and engineers on multiple National Science Foundation-funded projects, and with lawyers on developing legal technology. More information can be found at <a href=""http://johnjnay.com/"">johnjnay.com</a>.</p> <p><b>Sponsors:</b></p> <p>This event is sponsored by the <a href=""http://business.gwu.edu/programs/specialized-masters/m-s-in-business-analytics/academic-program/"">George Washington Business School MS in Business Analytics Program</a>, <a href=""http://bit.ly/12YljkP"">Statistics.com</a>, <a href=""http://datamininglab.com/"">Elder Research</a>, <a href=""https://www.novetta.com/"">Novetta</a>, <a href=""http://www.predictiveanalyticsworld.com/gov/2016/"">PAWGOV</a>, <a href=""http://www.oreilly.com/"">O'Reilly</a>, <a href=""https://www.boozallen.com/consulting/strategic-innovation/nextgen-analytics-data-science"">Booz Allen Hamilton</a>, and <a href=""http://engineering.aol.com/"">AOL</a>. (Would your organization like to sponsor too? Please get in touch!) </p>","Data Science DC","Predicting and Understanding Law with Machine Learning",1470090600000
"136",1,2,0,0,"<p>After taking off the month of July, DC NLP is back with a bang in August! We'll be meeting at Comcast Labs DC again this month with two fantastic presentations on Deep Learning for NLP and advanced Search Engines. Also, courtesy of our friends at O'Reilly Media, we'll have a bunch of swag to give away including books, t-shirts, and other assorted goodies. This is sure to be an event you won't want to miss!</p> <p>First up, <b><a href=""https://www.linkedin.com/in/ari-chanen-phd-3390253"">Ari Chanen</a></b>, Lead AI Engineer at <a href=""https://twitter.com/MITREcorp"">MITRE</a>, will give a talk about his recently-published paper entitled &lt;a&gt;""Deep Learning for Extracting Word-level Meaning from Safety Report Narratives""&lt;/a&gt; which he presented at the aviation-focused 2016 <a href=""http://i-cns.org/"">Integrated Communication Navigation and Surveillance</a> conference. This work is focused on practical questions surrounding the use of the deep learning technique word2vec. The first novel technique Ari will discuss is a way of picking a reasonable number of dimensions for a word2vec model which is based on the level of disagreement between a set of models trained on the same data. No training data is needed for this technique. The second novel technique is using multiple word2vec models together in an ensemble model to get a more robust set of similar terms over using a single word2vec model.</p> <p>For our second talk, <b><a href=""https://www.linkedin.com/in/kramdl"">Mark Lidd</a></b>, Team Lead at <a href=""https://twitter.com/datafission"">DataFission</a>, will give a presentation on <a href=""http://www10.giscafe.com/blogs/gissusan/2016/07/29/datafissions-new-duse-search-engine-lets-you-search-any-unstructured-data/"">DUSE: a content-based search engine for digesting and searching unstructured data</a>. DUSE allows users to search anything digitally, from video, audio, network traffic, satellite images, radar data, malware, and images -- as well as unstructured text -- all in one search. Unlike traditional search engines such as Yahoo, Google, and Microsoft that have been around for 15 years, searching with DUSE doesn't require further work to search the medium the user requires. It contains both simple APIs and GUIs that provide rankings and answers to complex data queries to uniforms and analysts, as well as advanced controls for data scientists, such as access to live data structures and tools at a very deep level.</p> <p>*************************</p> <p>A brief note from O'Reilly Media:</p> <p><i><b>Discover the real-world opportunities of applied artificial intelligence</b></i></p> <p><i>AI is (finally) driving an explosion in intelligent software—bots, agents, voice and IoT interfaces. Learn how to implement AI in real-world projects today and explore what the future holds for intelligence engineering. <b>Save 20% with discount code UGDCNLP.</b> Check out the impressive agenda and speaker lineup. <a href=""http://www.oreilly.com/pub/cpc/21357""><a href=""http://www.oreilly.com/pub/cpc/21357"" class=""linkified"">http://www.oreilly.com/pub/cpc/21357</a></a></i></p> <p><img src=""http://photos2.meetupstatic.com/photos/event/4/b/f/9/600_452719449.jpeg"" /></p> <p>************************</p> <p><br/>We'll gather starting at 6:30pm at <a href=""http://dclabs.comcast.com/"">Comcast Labs</a> - someone will greet you outside and let you into the building. Introductions &amp; announcements will start around 7:00pm, and presentations will begin at 7:30pm. Afterwards, there will be plenty of time for follow-up questions, networking, and more.</p> <p>DC NLP meets each month to network, socialize, and learn about the interesting work folks are doing in natural language processing, computational linguistics, text analytics, and more.</p> <p>Do you have something you'd like to share with the group? Let us know! We're always looking for speakers to give talks at future meetups, and don't forget to follow <a href=""https://twitter.com/DCNLP/"">@DCNLP</a> on Twitter!</p>","DC Natural Language Processing","August Meetup: two great talks PLUS a giveaway!",1470781800000
"137",1,2,0,0,"<p>Join us on <b>Wednesday, August 10th, 2016</b> as we discuss <b>Exploitation</b>. </p> <p>This meetup will focus on gaining familiarity with using the Exploit Database, the Metasploit Framework, as well as using MSFvenom and generating payloads. Those who wish to participate should have Kali Linux 2.0 and the Metasploit Database already installed. Take home material will be provided prior to the meetup. Read ahead material can be found at the following locations:<br/>* <a href=""https://www.exploit-db.com/"" class=""linkified"">https://www.exploit-db.com/</a><br/>* <a href=""https://www.offensive-security.com/metasploit-unleashed/msfconsole-commands/"" class=""linkified"">https://www.offensive-security.com/metasploit-unleashed/msfconsole-commands/</a><br/>* <a href=""https://www.offensive-security.com/metasploit-unleashed/msfvenom/"" class=""linkified"">https://www.offensive-security.com/metasploit-unleashed/msfvenom/</a><br/>* <a href=""https://www.offensive-security.com/metasploit-unleashed/generating-payloads/"" class=""linkified"">https://www.offensive-security.com/metasploit-unleashed/generating-payloads/</a><br/>* <a href=""http://docs.kali.org/general-use/starting-metasploit-framework-in-kali"" class=""linkified"">http://docs.kali.org/general-use/starting-metasploit-framework-in-kali</a></p> <p><b>Keynote Speaker(s):<br/>Mr. Tyrone E. Wilson</b> - is a cybersecurity expert with 20 years of experience in information technology and systems configuration, including information systems and network security. Wilson also has extensive knowledge in computer network defense, vulnerability assessments, cyber threat analysis, and incident response. As a former cybersecurity analyst for the United States Army, Wilson developed security structures to ensure American intelligence systems were protected from foreign threats. Wilson is the Founder and CEO of Cover6 Solutions, LLC; which teaches companies and professionals aspects of information security, penetration testing, and IPv6.<br/>* <b>LinkedIn</b> - <a href=""https://www.linkedin.com/in/tyroneewilson"" class=""linkified"">https://www.linkedin.com/in/tyroneewilson</a></p> <p><b>Mr. Eugene Wright</b> - is a cyber security engineer who enjoys finding unconventional solutions to complex problems. With over 10 Years of hands-on experience. His career is highlighted on employing best practices in software engineering methodologies, system/security engineering principles, secure design and secure architecture. His latest work is focused on engineering secure architectures to allow DoD classified system to operate safely in public cloud environments.</p> <p><b>Meetup Location: </b><br/>WeWork - Crystal City<br/>2221 S. Clark St.<br/>Arlington, VA 22202<br/>(855)[masked]<br/>Google Map: <a href=""https://goo.gl/maps/x7MJuQH7QSD2"" class=""linkified"">https://goo.gl/maps/x7MJuQH7QSD2</a></p> <p>This meetup will be held on the 12th floor, personnel will be onsite to assist.</p> <p><br/><b>Time:</b><br/>6:00-8:30 pm </p> <p><b>Agenda: </b><br/>6:00 - 6:15 Networking with Peers<br/>6:15 - 7:00 Metasploit Familiarization &amp; Exploit-DB  <br/>7:00 - 7:15 Networking with Peers<br/>7:15 - 8:00 MSFvenom and Generating Payloads<br/>8:00 - 8:30 Closing remarks, networking &amp; clean up</p> <p><b>Parking: </b><br/>223 23rd St. S.<br/>Arlington, VA 22202<br/>Google Map: <a href=""https://goo.gl/maps/mt5Dj9ATzgS2"" class=""linkified"">https://goo.gl/maps/mt5Dj9ATzgS2</a></p> <p><b>Meetup Sponsorship:</b> With nearly 3,000 members, our group is full of Information Security professionals enthusiastic about staying abreast to new trends and changes in the industry. As a potential sponsor, not only will you have the opportunity to reach the Meetup community but all of our social media outlets that we use to promote you and your business endeavors. Please email us for additional details.</p> <p>The D.C. Cyber Security Professionals Meetup group was formulated to make our mission to give back to the IT community. Any and all efforts that you make to help us continue our movement is greatly appreciated. We rely on member contributions to cover our costs as well as provide members discounts on training, books and conferences. The DC Cyber Warriors team and Cover6 will continue to strive to make this IT Community great!</p> <p>Very Respectfully,</p> <p><b><i>The Cover6 Solutions Team</i></b> </p> <p><b>Email:</b> [masked]<br/><b>Facebook:</b> <a href=""https://www.facebook.com/dccyberwarriors"" class=""linkified"">https://www.facebook.com/dccyberwarriors</a><br/><b>Twitter:</b> <a href=""https://twitter.com/dccyberwarriors"" class=""linkified"">https://twitter.com/dccyberwarriors</a><br/><b>Web: </b><a href=""http://www.cover6solutions.com/meetup/"" class=""linkified"">http://www.cover6solutions.com/meetup/</a><br/><b>Contributions:</b> [masked] (Paypal)<br/><b>Jobs:</b> <a href=""http://www.meetup.com/D-C-Cyber-Security-Professionals/pages/20752307/Job_Opportunities/"" class=""linkified"">http://www.meetup.com/D-C-Cyber-Security-Professionals/pages/20752307/Job_Opportunities/</a><br/>@DCCyberWarriors #DCMeetup1615 #C6S</p>","D.C. Cyber Security Professionals","DCMeetup1615 - Exploitation",1470866400000
"138",1,1,0,0,"<p>Our speaker will be Michael Alaimo.</p>","DC PHP Developer's Community","PHP and Input Validation",1470868200000
"139",1,1,0,0,"<p><b>Nirmal K. Singh has over 9 years of Software Development experience in various industries and has worked at  </b><b>BlueCross Blue Shield (claims), </b><b>CenturyLink (abstract router for telephony), </b><b>FedEx (air ops), </b><b>C&amp;S (warehouse), </b><b>Wyndham WorldWide (RCI), </b><b>Thomson Reuters (Legal), </b><b>Capital One, </b><b>AARP .</b></p> <p><b>He will be covering data cleansing / processing with Spark and Scala at the next meetup. </b></p> <p><b>Topics covered at Meetup</b></p> <p>• <b>Cleansing Data with Spark (analytics) (Scala and Java)</b></p> <p><b>• Lazy and Lambdas, Singleton, Lineage</b></p> <p>• <b>Spark OOP and Sql based</b></p> <p>• <b>DataBricks, AWS, notebook</b></p> <p>• <b>Streaming vs. Micro Batches</b></p> <p><b>• Codecs, Spark version 2.0</b></p>","Data Wranglers DC","August Meetup - Data Cleansing w/ Spark / Scala",1470868200000
"140",1,1,0,0,"<p>React Native has taken the mobile app development community by storm. In this talk Jay Garcia will walk you through what it's like to develop mobile applications with React Native from a web developer's perspective.</p>","DCJS","[DCJS-37] - React native mobile app development",1470954600000
