"","applicable","male","female","nonBinary","desc","group","name","time"
"95",1,1,0,0,"<p>Come and take a peak how professional software engineers and data scientists code a project from A to Z. This live presentation will guide you through a step-by-step  process of assembling, engineering and deploying a topic model (using Python and built-in libraries) in real-time. </p> <p><b>--- TALK OUTLINE ---</b></p> <p>Most of us think of search as typing in a few words into our favorite search engine and getting back a list of results. But search can be so much more.<br/>Machine learning researchers have been finding more and more ways to use unsupervised learning methods to explore unstructured content. One of the leading methods is topic modeling, which discovers themes/topics in a large collection of data.<br/>This tutorial will be a live topic modeling coding demo going through each step of the data science pipeline from the perspective of a data scientist.  </p> <p><br/><b>-- SPEAKER --</b><br/>Daewoo Chong is a software engineer/data scientist at Booz Allen Hamilton. He is currently a lead search engineer on an enterprise search project and has been using topic modeling and deep learning to tune relevance and search data in novel ways. His interests include rapid prototyping, information retrieval, natural language processing, and machine learning.</p> <p><img src=""http://photos4.meetupstatic.com/photos/event/6/3/d/4/600_447925556.jpeg"" /></p> <p><b>-- TENTATIVE SCHEDULE --</b></p> <p>6:30-7:00 - Networking <br/>7:00-7:10 - Introductions <br/>7:10 - 8:10 - Talk <br/>&gt; 8:10- Socializing</p>","Data Education DC","Live Topical Topic Modeling: From Ingestion to Learning to Visualization",1459981800000
"96",1,2,1,0,"<p>This month's social data meetup is focussed on finding the political hotspots in Social Data. </p> <p><i>Edward Crook, </i><b><a href=""https://www.brandwatch.com"">Brandwatch</a></b><i>, </i>Senior Research Analyst -<i> <b>""</b></i><b>An Analysis of the Syrian Migrant Crisis"" </b>- How social is shaping the story and how online data can be worked to reveal insights<i>. </i></p> <p><i>Jeff Long</i>, <b><a href=""http://www.DataMinr.com"">DataMinr</a></b>, ""<b>Social Media as a Global Sensor Network</b>"" Jeff Long is the head of Dataminr's state and major city partnerships business. Previously, Jeff worked on Capitol Hill as a policy adviser and held business development roles at start-ups, <a href=""http://revolutionhealth.com/"">RevolutionHealth.com</a> and DNA Direct. Jeff graduated from Hamilton College with a B.A. and received his M.B.A. from the University of Virginia.  </p> <p><i>Professor Dame Wendy Hall </i><a href=""http://www.ecs.soton.ac.uk/people/wh"">The University of Southampton, </a><a href=""http://www.ecs.soton.ac.uk/people/wh"">UK</a>, <b>""</b><b>Observatories and Data Analytics for Web Science</b>"" is Executive Director of the Web Science Institute at Southampton. She will discuss the role of observatories and data analytics for the development of new methodologies for longitudinal research in Web Science as well as applications for business intelligence and policy making in general.<br/> </p>","Social Data and Analytics - DC","Finding the Hotspots on the Globe through Social Data",1460068200000
"97",1,1,0,0,"<p>Have you ever wanted to scale R but are limited due to memory? In this talk Joseph Rickert, blogger, data scientist and R community Ambassador introduces the latest R technology to scale your data analysis.</p> <p>-- TALK OUTLINE -- </p> <p><br/>Microsoft R Server (formerly Revolution R Enterprise) has become the foundation for Microsoft’s use or the R language to tackle big-data machine learning and predictive analytics tasks. At the heart of MRS is the RevoScaleR package that implements a number of parallel external memory algorithms. These “PEMAs” are inherently parallel and designed for distributed computing on large data sets. Unlike standard open source R functions they do not require all of the data to be in memory at one time. I will provide an overview of MRS and show some examples of PEMAs working on data sets too large to be processed by open source R algorithms on my laptop.</p> <p>-- SPEAKER --</p> <p><b>Joseph Rickert</b> is a Program Manager and R Community Ambassador for Microsoft. He came to Microsoft with the rest of Revolution Analytics team where he worked as a data scientist, blog editor and special programs manager.  He is currently Microsoft’s representative to the R Consortium’s Infrastructure Steering Committee and a member of the organizing committee for useR!2016. </p> <p>Previously, Joe held a variety of technical and marketing roles while working for technology startups that spanned multiple industries from local area networks to disk drives, test equipment and health care. Joe entered Franklin &amp; Marshall college on a Classics scholarship and end up a Math major. He also earned an M.A. in Humanities and an M.S. in Statistics from the California State University. You can follow Joe on Twitter as @RevoJoe</p> <p>-- TENTATIVE SCHEDULE --</p> <p>6:30-6:50 - Networking <br/>6:50-7:00 - Introductions <br/>7:00 - 7:50 - Talk <br/>7:50 - 8:30 - Socializing</p> <p>-- NOTE --</p> <p>This event has limited seating capacity. </p> <p>You can reserve <a href=""https://www.eventbrite.com/e/special-event-scaling-r-using-parallel-external-memory-algorithms-tickets-23311454187"">reserve your place on  the Eventbrite page*</a>. </p> <p>*The event is FREE to attend but reserving your place through Eventbrite guarantee's your place.</p> <p>-- LOCATION --</p> <p>WeWork- Dupont Circle <br/><i>WeWork is a community for creators. We transform buildings into beautiful, collaborative workspaces and provide infrastructure, services, events and technology so our members can focus on doing what they love.""</i> </p> <p><img src=""http://photos2.meetupstatic.com/photos/event/9/7/6/3/600_448358755.jpeg"" /></p> <p><img src=""http://photos2.meetupstatic.com/photos/event/9/7/6/5/600_448358757.jpeg"" /></p> <p>


<img src=""http://photos4.meetupstatic.com/photos/event/9/8/8/5/600_447699045.jpeg"" /></p>","Data Education DC","Special Event- Scaling R Using  Parallel External Memory Algorithms",1460498400000
"98",1,2,1,0,"<p>DATE CHANGE!!  THIS EVENT HAS BEEN <b>CHANGED TO TUESDAY, 4/19</b>, AND WILL BE HELD AT WOMBLE CARLYLE (4th floor; <a href=""http://files.meetup.com/14077672/WCSR%20Tysons%20Corner%20Office%20-%20directions1.pdf"">directions here</a>).  WE APOLOGIZE FOR ANY  INCONVENIENCE!  PLEASE UPDATE YOUR RSVPs ACCORDINGLY.  </p> <p>Digital interactions make up an ever-increasing portion of all customer/visitor interactions. Many market-leading companies like Lenovo have recognized that knowing the high-level web and mobile statistics about their visitors is valuable but not actionable. The key to understanding the needs of customers and visitors and delivering personalized experiences is predictive behavioral analytics, which requires integrating clickstream and other enterprise data on a Hadoop/Spark cluster. The clickstream data as generated by the leading marketing cloud providers like Adobe, Google, and IBM are also varied and complex with over a 1000 configurable fields. However, the clickstream data has enough commonality across enterprises that deploying a configurable purpose-built predictive behavioral application like SYNTASA can deliver significantly better time-to-value and ROI compared to an in-house development effort. In this session we will describe 1) Lenovo’s build vs. buy decision and 2) What makes Spark the ideal platform for building an predictive behavioral analytics application like SYNTASA that can be deployed on in-house Hadoop Cluster.</p> <p><b>Agenda: </b>


<br/>6:00pm – Appetizers &amp; Networking<br/>6:30pm – Introductions<br/>6:45pm – Ashish &amp; Charmee’s presentation<br/>7:45pm – Open discussion<br/>8:00pm – Adjourn for Networking</p> <p><b>Bios: 

</b><br/><i>Ashish Braganza</i> - Ashish Braganza is Director of Global Business Intelligence at Lenovo and responsible for Digital Personalization, Optimization, BI and Big Data Analytics. He leads a global team of 40 Business Analysts, Data Scientists, Modelers, Visualizers and Big Data Architects. He built Lenovo’s first Big Data Platform and draws on his extensive management experience in running and building enterprise analytics for fortune 500’s. He has published articles on Optimization, Digital Strategy, Enterprise Analytics Management and is a frequent industry speaker.<br/>Prior to Lenovo, Mr. Braganza was Manager of Digital Analytics and Optimization at Comcast Cable. In that role, he led the Analytics &amp; Optimization practice for the eCommerce and Digital Self Service channels at Comcast. Mr. Braganza has earned an M.S in Quantitative Marketing from Temple University, The Fox School of Business &amp; Management, Philadelphia and an MBA and BS in Business Administration from University of Pune, India</p> <p><br/><i>Charmee Patel </i>- Charmee Patel is a Data Architect at Syntasa and is working on building next generation Advanced Analytics Application that can handle many types of digital interactions and allows it's users to gain Behavioral Insights quickly. Prior to Syntasa she was doing Distributed Data Processing at Telarix; mastering the concept of pushing Computations to Data instead of Data to Compute nodes well before Hadoop revolutionized large scale distributed storage and computing on commodity hardware.</p> <p><br/><i>Shawn Zargham </i>- Shawn is an expert in leveraging advanced technologies to build software solutions that focus on user requirements and solve high impact business problems. Prior to joining SYNTASA, Shawn was the co-founder and CTO of Telarix, where he built a high performance near real-time event processing, analytics, and optimization product that currently processes over 20% of all international call detail records worldwide. Shawn strongly believes the recent advances in big data, cloud, and mobile technologies will fundamentally transform how businesses operate.</p> <p><b>PARKING &amp; METRO</b></p> <p>There is a garage attached to the building and parking passes will be provided at the event.  </p>","Washington DC Area Apache Spark Interactive","DATE CHANGE: Accelerating Behavioral Analytics at Lenovo using SYNTASA on Spark",1461103200000
"99",1,1,2,0,"<p>This meetup that will examine how data and data science can help tackle the global pandemic of sexual assault and rape, featuring multiple speakers from the field.</p> <p><br/><b>Schedule</b></p> <p><i>We will be changing up the format of our event. Please note that we will be starting earlier than in the past.</i></p> <p>6:00 PM - Doors open</p> <p>6:15 PM - Introductions</p> <p>6:25 PM - First Speaker</p> <p>6:50 PM - Intermission and Food</p> <p>7:05 PM - Second Speaker</p> <p>7:25 PM - Short Break</p> <p>7:30 PM - Third Speaker</p> <p>


<b>Jessica Ladd - Founder &amp; CEO of Sexual Health Innovations</b></p> <p>Jess is the Founder &amp; CEO of Sexual Health Innovations (SHI), a nonprofit dedicated to creating tech to advance sexual health and wellbeing in the United States. SHI's main initiative is Callisto, an online trauma-informed sexual assault reporting system.<b><br/></b></p> <p><img src=""http://photos1.meetupstatic.com/photos/event/3/3/7/4/600_448273172.jpeg"" /></p> <p>


Jess has been honored as a TED Fellow, a Fearless Changemaker by the Case Foundation, an Emerging Innovator by Ashoka and American Express, and as the Civic Hacker of the Year by Baltimore Innovation Week. Before founding Sexual Health Innovations, Jess worked in the White House Office of National AIDS Policy, as a Public Policy Associate at The AIDS Institute, and as a sexual health educator and researcher for a variety of organizations. Jess also founded The Social Innovation Lab in Baltimore and a chapter of FemSex at Pomona College. Jess received her Masters in Public Health at Johns Hopkins and her BA in Public Policy/Human Sexuality at Pomona College. She left a PhD program in infectious disease epidemiology at Johns Hopkins in order to pursue work at Sexual Health Innovations full-time.</p> <p>


<b>Amanda Nguyen - President and Founder, Rise</b></p> <p>Amanda is the president and founder of Rise, a millennial driven national nonprofit working with multiple state legislatures and the U.S. Congress to implement a Sexual Assault Survivor Bill of Rights. In her capacity for Rise, she has drafted and helped introduce legislation in multiple Statehouses and the United States Congress. </p> <p>Amanda’s start in public service began at NASA where she worked on the last space shuttle launch, public-private partnerships and the Asteroid Redirect Grand Challenge Mission. She has also worked at the White House in the Office of Public Engagement and the Chief of Staff’s office, at Morgan Stanley in public finance investment banking, and at the Harvard-Smithsonian Astrophysics Center analyzing the Kepler exoplanet mission. Amanda graduated from Harvard University. During college, Amanda created the first student-written course in Harvard's history and co-founded Wema Children, an orphanage in Kenya. </p> <p>When she is not fighting for survivor rights, Amanda is also the Deputy White House Liaison at the Department of State and a 2016 TED fellow. She is 24 years old.  </p> <p>



<b>NATHAN W. GALBREATH, PH.D., M.F.S.</b></p> <p>Dr. Nate Galbreath is the Senior Executive Advisor for the Department of Defense Sexual Assault Prevention and Response Office (SAPRO).  In this position, he is the Department’s Highly Qualified Expert for DoD Sexual Assault Prevention and Response (SAPR) programs, training initiatives, and research involving applications of behavioral health, forensic science, criminal investigation, and program evaluation.  Dr. Galbreath reports directly to the SAPRO Director, who serves as the single point of authority, accountability, and oversight for the SAPR program in the Department of Defense.</p> <p>Dr. Galbreath was assigned as the first military Deputy Director of the DoD Sexual Assault Prevention and Response Office from 2007 to 2009. He retired from active duty on October 1, 2009 and worked as a licensed clinical psychologist and forensic science specialist in independent practice in the Washington, DC metropolitan area.  He was appointed to his current position at SAPRO in May 2012.</p> <p>He entered the Air Force in 1989 after completing a BA in Spanish and International Affairs at the University of Puget Sound, Tacoma, WA. He was assigned to Howard Air Force Base, Panama, from 1989 – 1990 as a Special Agent for the Air Force Office of Special Investigations (AFOSI). He went on to serve a total of 11 years with AFOSI as an agent, a forensic science specialist, and a Detachment Commander (Special Agent in Charge) at Air Force base offices in New Mexico, Colorado, and Utah.</p> <p>Dr. Galbreath was competitively selected by the Air Force to earn a Master of Forensic Science from the George Washington University, Washington, DC (awarded in 1993), and a Ph.D. in Clinical Psychology, from the Uniformed Services University of the Health Sciences (USUHS), Bethesda, MD (awarded in 2004). He has also completed a number of internships and fellowships, including a fellowship in Forensic Medicine at the Office of the Armed Forces Medical Examiner, Armed Forces Institute of Pathology, Washington, DC, and a clinical psychology residency at Malcolm Grow Medical Center, Andrews Air Force Base, MD.</p> <p>Dr. Galbreath’s clinical experience focused on treating and researching sexual dysfunction and sexual disorders. He also evaluated and treated sex offenders with Dr. Fred S. Berlin at the National Institute for the Study, Prevention and Treatment of Sexual Trauma, which is affiliated with the Johns Hopkins Medical School in Baltimore, MD.  He also served as the Behavioral Health Clinic director at Minot Air Force Base in North Dakota, where he supervised mental health, family advocacy, and alcohol/drug treatment programs from 2004 to 2007. He is currently a licensed psychologist in the state of Maryland.</p> <p>Dr. Galbreath maintains close ties to the law enforcement community. He has provided training at national and international conferences hosted by the Federal Bureau of Investigation, the Department of Defense, the Department of Justice, the Norwegian Ministry of Defence, and other non-governmental organizations. He serves as a Professorial Lecturer in the Forensic Sciences at the George Washington University, where he created one of the nation’s first graduate level courses on child abuse investigations.  He also teaches a graduate course on sexual assault investigations.  He is an adjunct associate professor in the Department of Medical and Clinical Psychology at USUHS.  Dr. Galbreath has also published a book chapter on child molesters, co-authored a chapter on sexual disorders and the Internet, and co-authored journal articles relating to sex offender recidivism and online sexual problems.  He has been a primary author on the Department of Defense Annual Report on Sexual Assault in the Military since 2007. </p>","Data Innovation DC","Data for Good - How Data Escrow and Science Can Help End Rape",1461103200000
"100",1,1,0,0,"<p><b>Come and join us for our April talk about Rainforest and the fight to test big legacy apps with <a href=""https://twitter.com/milespj"">Paul Miles</a>!</b></p> <p>New, on-demand testing services such as <a href=""https://www.rainforestqa.com/"">Rainforest</a> provide a compelling alternative to traditional test automation capabilities provided by frameworks like <a href=""http://www.seleniumhq.org/"">Selenium</a>.</p> <p>In this talk, Paul will demonstrate the capabilities of Rainforest. He'll also speak about the <a href=""http://www.npr.org/"">NPR</a>'s quest to build out test coverage using Rainforest and other types of tests to achieve broader organization goals such as continuous deployment.</p> <p><b>Agenda:</b></p> <p>• 6:30-7:00pm - Arrive, catch up, and eat (courtesy <a href=""https://www.twilio.com/"">Twilio</a>)</p> <p>• 7:00-7:10pm - Announcements</p> <p>• 7:10-8:00pm - Talk + Q&amp;A</p> <p>• 8:00-8:15pm - Wrap-up</p> <p>• 8:15pm - Migrate to a nearby bar</p>","Django District, etc.™","Testing-as-a-Service with Rainforest (and the Fight to Test Big Legacy Apps)",1.461105e+12
"101",1,1,0,0,"<p>Full-stack developers have a lot to deal with these days: CSS frameworks, frontend MVCs, REST servers, databases, and more. That not including any infrastructure, containerization, and additional operations work. The three end states for full-stack devs are trying to do everything themselves (resulting in poor quality across the board), working endlessly (ending in burnout), or compromising on overall control of everything and augmenting their skills with frameworks and tools. This talk discusses how to best come to terms with relinquishing control and finding good frameworks when it comes to frontend development.</p> <p>About Brian<br/>I'm a full-stack developer who adopted frontend development out of necessity. I normally work with a Java stack, though I've worked in many other languages as any developer will. Most of my experience is in rapid application development spanning from infrastructure to UI. My hobbies include drinking coffee and finding new open-source projects.</p> <p>GitHub: <a href=""https://github.com/TheConnMan"" class=""linkified"">https://github.com/TheConnMan</a><br/>Website: <a href=""http://theconnman.com/"" class=""linkified"">http://theconnman.com/</a></p>","Tech Talk DC","Frontend Development for Full Stack Devs by Brian Conn",1461189600000
"102",1,1,0,0,"<p><b>Abstract:</b></p> <p>Using no 3rd-party code, we'll build <a href=""http://expressjs.com/"">Express</a> from the ground up.</p> <p>We'll use the <a href=""https://nodejs.org/dist/latest-v4.x/docs/api/http.html"">core http module</a> and plain ol' Javascript to build a web framework - express clone.</p> <p><b>Presenter:</b> <a href=""https://jesse.sh/"">Jesse Shawl</a></p> <p>Thanks to our sponsors: <a href=""https://www.socialtables.com/"">Social Tables</a> for hosting and <a href=""https://strongloop.com/"">StrongLoop</a> for food and beverage!</p>","node.dc","Express From Scratch",1461277800000
"103",1,1,0,0,"<p>Deep learning - back by popular demand!</p> <p>In this lecture Nvidia will be giving a special hands-on presentation on implementing <b>deep learning </b>architectures with their <b>CUDA technology</b>. You will also have a chance to win a Titan X Graphics card!</p> <p><br/>In this session you will learn about recent computational advances in GPU architectures that dramatically speed up training of deep architectures as well as their implementation through the DIGITS training software.</p> <p>===== TALK OUTLINE =====</p> <p>Machine Learning (ML) has become a pervasive technology, underlying many modern applications. Machine learning techniques are a powerful tool for sifting through large datasets.  Recent advances in Deep Learning (DL) provide methods that can be used to automatically classify images and objects with human-level  performance.  With Deep Learning, big data is part of the solution, not the problem.  DL is rapidly becoming a key tool at many of the top technology companies around the world.</p> <p>The talk will introduce DL in the broader context of machine learning, and describe the factors driving the success of DL, and the key phases and considerations of developing and deploying DL systems on GPUs.  We will review the popular open source toolkits and companies with relevant products. We will walk through an example of using DIGITS, NVIDIA’s easy-to-use software for training and deploying Deep Neural Networks, that is accessed using a web browser. There will be time for questions and references for many more training resources.</p> <p>====== SPEAKER ======</p> <p>Larry Brown is a Sr. Solution Architect with NVIDIA, where he helps customers design and deploy GPU accelerated workflows in high performance computing and data analytics.  He has a Ph.D. from the Johns Hopkins University, and a graduate certificate in Software Engineering from the University of Colorado. </p> <p>Larry has over 15 years of experience designing, implementing and supporting a variety of advanced software and hardware systems for defense and national security applications.  He has designed electro-optical systems for head-mounted displays and training simulators, developed GIS applications for multi-touch displays, and developed GPU computer vision code for UGVs.  </p> <p>Currently Larry enjoys learning about data analytics and machine learning. Larry has spent much of his career working for technology start-up companies, but was most recently with Booz Allen Hamilton before joining NVIDIA.</p> <p>

====== NOTES ======</p> <p>NVidia will be giving away a Titan X graphics card, so make sure you show up for a chance to win!</p> <p><img src=""http://photos1.meetupstatic.com/photos/event/1/f/8/d/600_448808077.jpeg"" /></p> <p>-- TENTATIVE SCHEDULE --</p> <p>6:30-7:00 - Networking <br/>7:00-7:10 - Introductions <br/>7:10 - 8:10 - Talk <br/>&gt; 8:10- Socializing</p>","Data Education DC","Professional Development Series: Deep Learning in Pratice with NVidia",1461277800000
