"","applicable","male","female","nonBinary","desc","group","name","time"
"61",1,1,0,0,"<p>Speaker: Michael Kalish</p> <p>Title: Introduction to using Reactive Extensions in  Angular 1</p> <p>Description: This talk will briefly cover the history of reactive extensions as well as a high level overview of what ""reactive programming"" means and the motivations behind it.  After taking a look at the basic API behind Reactive extensions, we'll then walk through coding a simple game in Angular1 using RxJS and the angular RxJs bindings.</p> <p>***********************************************************</p> <p><br/>Directions: Learning Objects is located on top of the North DuPont Metro exit (Red Line); exit towards Q St.</p> <p>There are a number of parking structures in the area. We recommend 11 Dupont Circle NW. Parking is $12/flat, open until 11pm, and a quick 3 minute walk to the entrance of our building.</p> <p>Enter the building through the main door facing Connecticut, then take the elevator to the second floor.</p> <p>We have a callbox to let people up to the second floor; our stairwell is off limits to everyone. Please try to arrive no later than 6:45pm to minimize disruptions.</p> <p>***********************************************************</p> <p>Schedule:</p> <p>6:30 - 7:00 Refreshments</p> <p>7:00 - 7:15 Intro &amp; Announcements</p> <p>7:15 - 8:15 Presentation</p> <p>8:15 - end &amp; socialize!</p> <p>***********************************************************</p> <p>Social: Be sure to tweet @diffengine #AngularJSDC</p>","AngularJS DC","Introduction to using Reactive Extensions in Angular 1",1453332600000
"62",1,1,0,0,"<p><b>Presenter:</b> Matthew Chase Whittemore <a href=""https://twitter.com/mcwhittemore"">@mcwhittemore</a></p> <p>So often we talk about programing as putting pieces together. We use words like ""engineering"" to imply that we have solid plans and scientific reasons for doing what we do.</p> <p>Nine months ago I got really burned out, in part because of this kind of thinking. I'm not a planner, I'm a doer, and so I started just smashing pixels together. The result was more like science than anything I'd done before, but calming and therapeutic, like art.</p> <p><br/>In this talk I'll cover a bit of what I did (the art) and theorize on why we should do it more (the science).</p> <p>And we'll see the results.</p> <p><img src=""https://cloud.githubusercontent.com/assets/357481/12097606/7511f054-b2ea-11e5-85c0-0bdaeff47dca.png"" /></p> <p><b>Schedule:</b></p> <p>6:30 - Arrive, socialize, and eat</p> <p>7:00 - Talk begins</p> <p>Food and beverage graciously sponsored by <a href=""https://strongloop.com/"">StrongLoop</a></p>","node.dc","Pure Science or Artsy Fartsy",1.453419e+12
"63",1,1,0,0,"<p>Data Visualization continues to evolve from a simple ‘nice to have’ on analysts’ resumes into a new career discipline of its own. Countless books, tutorials and classes have helped individuals master the technical skills necessary to build graphics and images. The difficulty some encounter is converting these technical skills into monetary rewards and benefits. The difficulty can come from finding paid freelance work, seeking a raise from your current employer for your talents, or seeking job opportunities solely focused on data visualization. A few simple concepts can help your clients and employer better appreciate and compensate you based on your ability to design and develop effective data visualizations. </p> <p><img src=""https://media.licdn.com/mpr/mpr/shrinknp_400_400/AAEAAQAAAAAAAAI-AAAAJGQ0YzIzZGMzLWEzYzYtNDA1NC05Mjc5LWQ3ODBjYzQ5NGQ0NA.jpg"" /></p> <p>Shay Anderson currently works for PricewaterhouseCoopers (PwC) Forensic Services: Investigative Analytics practice in Washington, DC where he helps clients’ model solutions in response to natural disasters, government regulation, accusations of fraud, potential litigation, and even sophisticated cyber-attacks. Before joining PwC Shay had over 15 years of experience in the fields of financial, data and business analysis, and has worked with Fortune 500 companies, state and federal agencies, small businesses, as well as the US military. Shay earned his first graduate degree in Information Management from the University of Maryland College of Information Studies (iSchool) where his thesis project on effective dashboard design and development received the Dean’s Award for Outstanding Development or Design (2011).  Shay just recently completed his second graduate degree in Information Visualization from the Maryland Institute College of Art (2015).</p> <p>Staff Sergeant Shay Anderson was Honorably Discharged from the Army National Guard after 15 years of service. He has over two decades of experience in crisis leadership and data visualization. Shay joined the Washington National Guard at seventeen where he was a member of the HHB 2-146 (Field Artillery) which supported the 81st Infantry Brigade.  Shay served his community and country in peacetime, in the early 90s SSG Anderson was awarded a Washington National Guard Emergency Service Military Ribbon for his courage in fighting wildfires, and in wartime during Operation Iraqi Freedom in 2003 and 2004, for his display of leadership and courage as Sergeant of the Guard commanding security forces at Camps Wolverine and Spearhead in Kuwait. In 2004 he was awarded the Army Commendation Medal.</p> <p>Shay’s proudest moment of national service was in 2003 as a Squad Leader for non-combat soldiers training to become a motorized infantry squad, which upon deployment became responsible for providing security to men and material traveling into and out of Iraq during the first year of Operation Iraqi Freedom. He says that this is proudest moment of service because “all of my squad members returned home healthy and without injury.”</p> <p><b><br/></b></p> <p><b>AGENDA</b></p> <p>• 6:30 - Doors open, networking</p> <p>• 7ish - Introductions &amp; Announcements</p> <p>• 7:15 - Monetizing Data Viz</p> <p>• 8:20 - Q&amp;A </p> <p>• 8:30 - Data Drinks</p> <p><b><br/></b></p> <p><b>ANNOUNCEMENTS</b></p> <p><b><a href=""http://www.districtdatalabs.com/"">District Data Labs</a> Workshops</b></p> <p><i><b><a href=""https://districtdatalabs.squarespace.com/fast-data-apps-with-spark-and-python/?DVDC"">Fast Data Applications with Spark &amp; Python - 1/23/2016</a></b></i></p> <p><i>Learn how to interact with Spark on the command line, conduct rapid in-memory analyses, and how to build distributed applications using Python and Spark.</i></p> <p><i><b><a href=""https://districtdatalabs.squarespace.com/web-scraping-with-python/?DVDC"">Web Scraping with Python - 1/30/2016</a></b></i></p> <p><i>Learn about web scraping concepts and how to create your own custom web scraper with Python.</i></p> <p><i><b><a href=""https://districtdatalabs.squarespace.com/building-data-apps-with-python/?DVDC"">Building Data Apps with Python - 2/6/2016</a></b></i></p> <p><i>Learn how to build a data product in Python using every stage of the data science pipeline including ingesting, wrangling, computing, and web-based reporting.</i></p> <p><br/><b><br/></b></p> <p><b>SPONSORS</b></p> <p><img src=""http://photos1.meetupstatic.com/photos/event/5/b/8/5/600_445643429.jpeg"" /></p> <p><img src=""http://www.statistics.com/images/logo_new.png"" /></p>","Data Visualization DC","Monetizing Data Viz",1454023800000
"64",1,1,1,0,"<p><b>***NOTE: Rescheduled to Tuesday, 2/2***<br/></b></p> <p><b>Come and join us for our January talk about static site generators!</b></p> <p>We're kicking off 2016 with a double-header on two different ways to generate static sites with Python:</p> <p><a href=""https://twitter.com/thurmSR"">Sara Thurman</a> will kick us off with a talk about using <a href=""http://blog.getpelican.com/"">Pelican</a>, the most popular Python static site generator.</p> <p><a href=""https://twitter.com/alexniderberg"">Alex Niderberg</a> will then tell us about an alternative approach using <a href=""http://flask.pocoo.org/"">Flask</a>, a web framework normally used for dynamically generated websites.</p> <p>Static site generators are a great tool to use for small sites or large sites that don't have very customized content. I'm excited for us to discuss this essential area of Python web development!</p> <p><b>Agenda:</b></p> <p>• 6:30-7:00pm - Arrive, eat and catch up (thanks to our food sponsor, <a href=""http://www.sweetprocess.com/"">SweetProcess</a>)</p> <p>• 7:00-7:15pm - Announcements</p> <p>• 7:15-8:00pm - Talks + Q&amp;A</p> <p>• 8:00-8:15pm - Wrap-up</p> <p>• 8:15pm - Migrate to a nearby bar</p>","Django District, etc.™","Static site generators with Sara Thurman and Alex Niderberg",1454455800000
"65",1,1,0,0,"<p>Have you ever faced long run times in R? Or wanted to speed-up your R functions?</p> <p>One of the main stumbling blocks when using R for the advanced (and not so advanced) programmer can be speed when manipulating large data sets or running computationally demanding tasks. This workshop is a primer on best coding practices, statistical methods and parallelization paradigms to speed up R.</p> <p><br/>==== WE'LL BRIEFLY GO OVER ====<br/>1. How data is processed and stored in memory<br/>2. Vectorization<br/>3. Statistical hacks (and need to knows)<br/>4. The Cpp package<br/>5. Easy Parallelization<br/>6. (Time permitting) Compilation / Hacking R's internal structure / Scaling through an Amazon Web Server </p> <p>==== WHAT YOU'LL NEED ====<br/>1. Laptop with R and RStudio installed<br/>2. Installed packages (coming soon)</p> <p>==== NOTE ====<br/>+ Seats for this workshop are limited so availability is on a first come basis.<br/>+ Participants who register but do not attend risk being removed from the listserve.</p>","Data Education DC","Essentials -  Speeding up R Workshop: Tricks, Hacks and need to know Methods",1454542200000
"66",1,1,0,0,"<p>This February, we are trying out a new day (MONDAY) and a new location (The Big Hunt, right off Dupont Circle). We're hoping this works out as a long-term home for us. Join us as we check it out.</p> <p><br/>Our speaker this month is from the Defense Advanced Research Projects Agency (better known as DARPA). Come get his perspective on how DARPA's using NLP today and the direction it will take in the future:</p> <p><i>DARPA has been a major driver of NLP research in the US for several decades. In this talk, Boyan Onyshkevych, currently a Program Manager at DARPA, will discuss several current NLP-related DARPA programs, and will provide his perspective on future NLP research directions.</i></p> <p><i>Dr. Boyan Onyshkevych is a Program Manager at DARPA's Information Innovation Office. His research interests include human language technologies and knowledge-based systems applied to the areas of information extraction, language understanding and semantic computing. </i></p> <p>************************</p> <p>We'll meet at 6:30pm at the Big Hunt, right of Dupont Circle. We'll be in the Jungle Room, the bar to the left. We'll do intros around 7:00 and move into the talk right around 7:30.</p> <p>DC NLP meets in the second week of each month to network, socialize, and learn about the interesting work folks are doing in natural language processing, computational linguistics, text analytics, and more.</p> <p>Do you have something you'd like to share with the group? Let us know! We're always looking for speakers to give talks at future meetups, and don't forget to follow <a href=""https://twitter.com/DCNLP/"">@DCNLP</a> on Twitter!</p>","DC Natural Language Processing","February: NLP at DARPA. NEW LOCATION",1454974200000
"67",1,1,0,0,"<p>Please join us <b>Tuesday, February 9th, 2016</b> as we discuss how to go beyond automated testing.  We’ll walk through several vulnerabilities identified during external penetration tests, discussing how they were found and then exploited to demonstrate the associated risk.  This discussion will also cover creative ways to enumerate services to help when scoping your testing.</p> <p>Are you interested in sharpening your external testing skills?Want to learn some tips and tricks to save time during an assessment?  Want to learn how to go beyond your automated tools?</p> <p>Some topics to be discussed include: Common vulnerabilities missed by automated tools, Burp Suite Pro, web shells, OSINT, the Shodan API, a creative testing mindset, useful training resources, and ways to save time using Python.</p> <p>We look forward to seeing you soon!</p> <p><b>Keynote Speaker(s): </b> </p> <p><b>Mr. Andrew McNicol</b></p> <p>Andrew McNicol is a security professional with over 10 years of experience in various Information Security roles including incident response, malware analysis, network forensics, vulnerability assessment, and penetration testing.  Andrew is currently the CTO of BreakPoint Labs where he specializes in offensive security services. He is also a mentor for the SANS Institute, as well as the co-founder and lead author of Primal Security.</p> <p>Andrew holds an M.S. in Information Assurance, and a wide variety of InfoSec qualifications (OSCE, OSCP, OSWP, GWAPT, GPEN, etc.). He enjoys solving problems, learning, mentoring, automating tasks, and hunting down exploitable vulnerabilities.</p> <p><b>Linkedin</b>:Andrew McNicol - <a href=""https://www.linkedin.com/in/andrewmcnicol""><a href=""https://www.linkedin.com/in/andrewmcnicol"" class=""linkified"">https://www.linkedin.com/in/andrewmcnicol</a></a></p> <p>

<b>Meetup Location</b>:<br/>Crystal City Marriott<br/>1999 Jefferson Davis Highway<br/>Arlington, Virginia 22202<br/>(0.1 miles from the Crystal City Metro) </p> <p>This meetup will be held on the Mezzanine level - signs will be posted near the elevator. </p> <p><b>Meetup Sponsorship</b>: With over 2,000 members, our group is full of Information Security professionals enthusiastic about staying abreast to new trends and changes in the industry. The Meetup group also allows vendors and speakers a chance to promote their products or themselves, while giving our members a chance to receive training in addition to potential member discounts to conferences and various gatherings. </p> <p><b>Parking</b>: Free parking is available at[masked]th St., Arlington, VA 22202. Use the Crystal City Shops tunnel to get to the hotel.</p> <p>We constantly search for new locations and innovative discussion topics. Feel free to send us any and all suggestions. Cover6 Solutions is dedicated to bringing you the finest training possible. The D.C. Cyber Security Professionals Meetup group is our way of giving back to the community. All efforts made to help us continue our movement are greatly appreciated. We rely on member contributions to cover our costs and make this community great! </p> <p>V/r </p> <p>The Cover6 Solutions Team </p> <p><b>Email</b>: [masked]<br/><b>Facebook</b>: <a href=""https://www.facebook.com/dccyberwarriors"" class=""linkified"">https://www.facebook.com/dccyberwarriors</a><br/><b>Twitter</b>: <a href=""https://twitter.com/dccyberwarriors"" class=""linkified"">https://twitter.com/dccyberwarriors</a><br/><b>Web</b>: <a href=""http://www.cover6solutions.com/meetup/"" class=""linkified"">http://www.cover6solutions.com/meetup/</a><br/><b>Donations</b>: <a href=""http://mkt.com/cover6"" class=""linkified"">http://mkt.com/cover6</a></p> <p>#C6S @DCCyberWarriors #DCMeetup1603</p>","D.C. Cyber Security Professionals","DCMeetup1603 - Beyond Automated Testing & Tools",1455058800000
"68",1,2,0,0,"<p><b>All - Unfortunately with the weather conditions and resulting travel issues (flights for our speakers have been canceled), we have decided to move this event to Feb 10th.  Sorry for any inconvenience but we hope to see you all then!  Please update your RSVPs accordingly.  -d</b></p> <p><b>~~~~~~~~~~~~~~~~</b></p> <p><b><br/></b></p> <p><b>Please see talk abstracts below</b></p> <p><b>Interactive Visualization of Streaming Data, Powered by Spark.</b></p> <p>Much of the discussion on real-time data today focuses on the machine processing of that data. But helping humans visualize real-time streams is just as important. Visualizing real-time data introduces new UX and usability challenges for any developer embedding analytics into applications, especially when the target end users are business users and not data scientists. Self-service, interactive, subsecond response time to ad hoc queries -- these are the new UX requirements for any enterprise visualizing real-time data. Streaming data also lends itself to new paradigms of interaction with the stream itself, like being able to pause, rewind and replay a stream. This talk is a case study in how and why Zoomdata built a ""Data DVR"" capability using Spark and SparkStreaming. Ruhollah Farchtchi, Chief Technologist &amp; VP of <a href=""http://www.zoomdata.com/"">Zoomdata</a> Labs will describe the required user experience, the overall architecture and the specific use of Spark and Spark Streaming. We will describe the design considerations that led us to choose Spark Streaming over alternatives like Storm. We will show how end users configure the real-time increment and a historical retention window without writing any code themselves. We will also show how pause, rewind, replay is implemented inSpark and how the solution supports both real-time and historical analysis in the same architecture. Attendees will walk away with knowledge of Spark Streaming and how users can interactively work with streaming data. They will develop familiarity with the challenges of a lambda architecture and providing a consistent analytic experience over streaming and historical data.""</p> <p><b> Leveraging Spark in a Hybrid OLTP/OLAP RDBMS</b></p> <p>In this talk, we will discuss how we use Spark as part of a hybrid RDBMS architecture that includes Hadoop and HBase. The optimizer evaluates each query and sends OLTP traffic (including CRUD queries) to HBase and OLAP traffic to Spark. We will focus on the challenges of handling the tradeoffs inherent in an integrated architecture that simultaneously handles real-time and batch traffic. Lessons learned include: - Embedding Spark into a RDBMS - Running Spark on Yarn and isolating OLTP traffic from OLAP traffic - Accelerating the generation of Spark RDDs from HBase - Customizing the Spark UI The lessons learned can also be applied to other hybrid systems, such as Lambda architectures.</p> <p><b>John Leach </b>is the CTO and Co-Founder of <a href=""http://www.splicemachine.com/"">Splice Machine</a>. With over 15 years of software experience under his belt, John’s expertise in analytics and BI drives his role as Chief Technology Officer. Prior to Splice Machine, John founded Incite Retail in June 2008 and led the company’s strategy and development efforts. At Incite Retail, he built custom Big Data systems (leveraging HBase and Hadoop) for Fortune 500 companies. Prior to Incite Retail, he ran the business intelligence practice at Blue Martini Software and built strategic partnerships with integration partners. John was a key subject matter expert for Blue Martini Software in many strategic implementations across the world. His focus at Blue Martini was helping clients incorporate decision support knowledge into their current business processes utilizing advanced algorithms and machine learning. John received dual bachelor’s degrees in biomedical and mechanical engineering from Washington University in Saint Louis. Leach currently is the organizer for the Saint Louis Hadoop Users Group and is active in the Washington University Elliot Society.</p>","Washington DC Area Apache Spark Interactive","DATE CHANGE: Interactive Visualization + Leveraging Spark in a Hybrid OLTP/OLAP",1455145200000
"69",1,4,0,0,"<p>Speakers:</p> <p>6:30 - 7:00 Doors Open</p> <p>7:00 - 7:05 Introductions</p> <p><b>7:05 - 7:30 </b><b>Topic Title: Social Data in International Development</b></p> <p><b>Dr. Craig Jolley <a href=""https://twitter.com/jolleywithane"">(@jolleywithane)</a> </b>is a AAAS Science &amp; Technology Policy Fellow in the U.S. Global Development Lab at the U.S. Agency for International Development. His work at USAID supports programs to combat global poverty and improve health, security, and economic growth by incorporating data science technologies into development planning, implementation, and monitoring. One particular focus area has been in social media analytics, where he has pursued social data as an information source for improved communications and outreach, as well as information on opinions, trends, and events in the developing world. He received his PhD in Physics from Arizona State University, and has researched biological physics and biomolecular networks at Montana State University and RIKEN. </p> <p><b>7:30 - 8:00: Social Data and 300 Global Embassies </b><br/><b><br/>Christopher Toppe and Mohammed Partovi - Department of State. </b>Problems and Solutions in managing 300 embassy social presences around the world in dozens of languages and character sets. Tools and Strategies in reporting on performance.</p> <p><br/><b>8:00 - 8:30: How Analytics Can Illuminate Digital Media Strategies</b></p> <p>David Bresnahan-McRae is a Manager of Client Strategy at Social Driver who specializes in digital advocacy projects. Before joining Social Driver, David received a Masters of Comparative Politics at the London School of Economics (LSE), and worked in Melbourne, Australia as a specialist in analytics and digital healthcare advocacy. </p>","Social Data and Analytics - DC","Social Good in Government: Leveraging Social Data",1.455147e+12
"70",1,1,0,0,"<p>Andy Cassell will be presenting on managing dependencies with composer! </p> <p>Andy is a full-stack web application developer and designer out in Herndon, VA. He builds PHP apps for the non-profit Marine Spill Response Corporation, the largest dedicated oil spill and emergency response organization.</p> <p>Talk description:</p> <p>Composer makes it incredibly easy to use open-source packages (dependencies) in your PHP projects. First we'll look at how to install and setup Composer. Then we'll go through some full examples of pulling in open-source dependencies via Packagist and using them in a project. Then we'll cover how to create and manage your own private/corporate package management server (using Satis) to make it easier to share library code between your own projects and integrate it into your development workflow.</p> <p><br/>Please join us to hear Andy's presentation. Refreshments will be served! </p>","DC PHP Developer's Community","Talk - Managing Dependencies with Composer and Hosting Your Own Package Server",1.455147e+12
"71",1,1,0,0,"<p>Have you ever heard of survival models? </p> <p>In this presentation we will introduce the basic concepts of survival models and build models interactively using R.</p> <p>Survival models are used in many applications, from predicting when a bond will default to a drug's impact on patient survival in clinical trials.<br/>This workshop assumes no prior knowledge and introduces modeling techniques from first principles. Survival models are build using R.</p> <p>==== WE'LL BRIEFLY GO OVER ====<br/>1. Applications of survival models in different industries<br/>2. Theory behind Survival modeling<br/>3. Error Metrics used in Survival Modeling<br/>4. Building Models: Parametric, Semi-Parametric, and non-parametric</p> <p>=== PRESENTER ===: </p> <p>Dallam Masterson is a data scientist at Pegged software where he uses his background as an engineer, actuary and statistician to develop sophisticated predictive models.</p> <p><br/>He has worked as a Data Scientist/Computational Statistician for startups, boutique analytics firm (Merkle) and as an actuary at (AEGON Americas). He has technical expertise in a variety of machine learning and statistical techniques, which he's always happy to chat about.</p> <p>Dallam received his MSc., Statistics from Rice University and obtained his BSc. in Operations Research and Information Engineering from Cornell.</p> <p>=== AGENDA ===:</p> <p>6:30 - 7:00 Mingle &amp; meet new people! <br/>7:00 - 7:05 Intros and announcements <br/>7:05 - 8:10ish Presentation/Q&amp;A <br/>then off to Data Drinks!</p> <p>


*For those who attend,  you will receive a link to code and slides (after the presentation) so that you can build your own models!</p>","Data Education DC","Foundations of Survival Analysis",1.455147e+12
